id,title,score,upvote_ratio,num_comments,author,subreddit,url,permalink,created_utc,is_self,text,flair,domain,search_query
1ol03l9,Happily Ever After Party- name and signage?,2,0.75,5,Enough-Lunch-7036,weddingplanning,https://www.reddit.com/r/weddingplanning/comments/1ol03l9/happily_ever_after_party_name_and_signage/,/r/weddingplanning/comments/1ol03l9/happily_ever_after_party_name_and_signage/,2025-10-31 17:01:49,True,"My husband and I had a 30 person destination wedding earlier this month. Next month we’re hosting a “happily ever after” party for all our local friends who couldn’t be there at a cocktail bar we own. 
Note that I think the term happily ever after party is kinda cheesy and I’m trying to avoid using it.

I did some mirror signs for the wedding that I loved making, is it okay to repurpose one? Will it look out of place? I have one that has our names in large lettering and says “welcome to our wedding” at the top. 
I thought about keeping the names and just writing “let’s celebrate!” or “celebration of marriage” at the top where it said “welcome to our wedding” before. 

I also have a full length selfie-mirror I did that says “all I want is you” (line from our first dance song) and our names. Is it cute or weird to bring that one? I’d love to see more people use it for selfies, but I don’t know if it’ll look out of place. 

We won’t have a lot of decor otherwise, the space is pretty cute itself. We’ll have a guestbook/cards table, and custom menus I made for the cocktails, but that’s about it. ",<praw.models.reddit.submission.SubmissionFlair object at 0x000001BA35BAFFB0>,self.weddingplanning,
1okw6i0,Full service New England wedding planner under $10k,3,0.8,4,Impressive_Champion4,weddingplanning,https://www.reddit.com/r/weddingplanning/comments/1okw6i0/full_service_new_england_wedding_planner_under_10k/,/r/weddingplanning/comments/1okw6i0/full_service_new_england_wedding_planner_under_10k/,2025-10-31 14:31:47,True,"We are planning at wedding at the Preserve At Chocorua in Tamworth NH for 2027. Due to the nature of the venue and a 3 day weekend wedding we have decided we need a planner. 

The three full service planners we have spoken too have all quoted us at $11k+. We don't need the best in the business but we do need some help. I am wondering if anyone has worked with a wedding planner and coordinator in this area in the $6-8k range that they could recommend. We don't really need much help with planning in terms of design, or invites or any of those sorts of logistics and really just need someone for Vendor Management and day of coordinating.

Or are we being unrealistic and $10k is just the price these days?

Any help would be appreciated. ",<praw.models.reddit.submission.SubmissionFlair object at 0x000001BA35C3DCA0>,self.weddingplanning,
1okzh3l,Wedding Photographer,2,1.0,7,MathematicianIcy3002,weddingplanning,https://www.reddit.com/r/weddingplanning/comments/1okzh3l/wedding_photographer/,/r/weddingplanning/comments/1okzh3l/wedding_photographer/,2025-10-31 16:37:54,True,"Hi all, this isnt a post asking for suggestions or anything for photographers because I have found several I like, however Im not sure how to choose which one.  Like they all seem to have good pictures, which is like anything to me cause im a typical regular iphone camera person.  Im not sure what else I should be looking for.  All said they can do the venue and everything so im stuck as to what else would make or break choosing one over the other?

  
ALSO the exact same question but with DJs lol 

Im bad at this please help.",<praw.models.reddit.submission.SubmissionFlair object at 0x000001BA35C3C1A0>,self.weddingplanning,
1ok2t00,Married under the most beautiful sycamore tree!,190,1.0,6,starsunlight222,weddingplanning,https://www.reddit.com/gallery/1ok2t00,/r/weddingplanning/comments/1ok2t00/married_under_the_most_beautiful_sycamore_tree/,2025-10-30 15:29:33,False,"Just wanted to share the wedding ceremony of our dreams - which all materialised super last minute! 

We had been planning the wedding for a while but we live in rainy UK and were not thinking about an outdoor spot at all. Our default indoor ceremony spot was a really plain room and wasn't our fave either, but we didn't mind because the rest of the building and lawns were beautiful. Cut to a day before our wedding - last minute blazing sun and heatwave, panic buying hand fans, (no aircon!), when our decorator suggests an underused spot under a sycamore tree as a balance between shade and ventilation. We had no photos of the spot, she literally sent us a google satellite image of the garden, that's all we had to go by, and we were like fine let's go for it.

When we got there the morning of we couldn't believe this was going to be where we would get married! Our harpist played as the light winds blew, the tree hung so low in some spots that our wedding party had to walk through the leaves, the ducks swam past as we said our vows, and it was just. a. fairytale.

What a beautiful time we had - I wish such joy for everyone on this subreddit and this planet!",<praw.models.reddit.submission.SubmissionFlair object at 0x000001BA35C3C3B0>,reddit.com,
1okikrk,wedding shuttle rides…how long is too long,21,0.97,35,jaysiggy,weddingplanning,https://www.reddit.com/r/weddingplanning/comments/1okikrk/wedding_shuttle_rideshow_long_is_too_long/,/r/weddingplanning/comments/1okikrk/wedding_shuttle_rideshow_long_is_too_long/,2025-10-31 02:06:54,True,"I need some help. I’m getting married next fall at a beautiful venue in the countryside of Minnesota, however it is in the middle of nowhere. 

We want to provide a transportation shuttle for our guests to and from the venue since it is quite a distance from major towns with halfway decent hotels. This was our bad that we didn’t do further research prior to booking, but on the venue’s website it said good hotels were 35 mins away (which is reasonable and we were like oh yeah that’s totally doable), but now that I’m plugging it into a map it’s around 45-50 minutes 🥲.

Do we think that people will be okay with riding on a bus for that long to and from the wedding? I’m trying to look at it as it’s complimentary ride that will get them back safe and so that they can drink and have a good time.

A majority of our guests are our age (25) and will likely not bat an eye at this, but I’m worried that the older guests will think this is CRAZY. But also, I’m thinking if you don’t want to ride the shuttle, you’re welcome to drive yourself and go wherever you need to go. 🤷🏽‍♀️

Side note: We attended a wedding this past year that had to shuttle people to different town 35 mins away as hotels in the city they got married in were compelled booked, and the buses were full each round….so it makes me think it would be fine? What’s 10 more minutes than that….

HELP IM LOSING SLEEP OVER THIS ",<praw.models.reddit.submission.SubmissionFlair object at 0x000001BA35C3C560>,self.weddingplanning,
1okwovx,Wedding Guest Books: What did you do?,2,1.0,18,oncefish,weddingplanning,https://www.reddit.com/r/weddingplanning/comments/1okwovx/wedding_guest_books_what_did_you_do/,/r/weddingplanning/comments/1okwovx/wedding_guest_books_what_did_you_do/,2025-10-31 14:51:42,True,"Hi! 2026 bride here. I’m also a graduate student, so I am planning a lot of stuff early. 

I am debating different guest book ideas and I would love to hear: 

1. What did you do? 
2. Pros and Cons of it? 
3. How much did it cost? 


Have loved the audio guest book or the Polaroids but have worried about costs. Let me know your thoughts!",<praw.models.reddit.submission.SubmissionFlair object at 0x000001BA35C3C710>,self.weddingplanning,
1okw48v,Suggestions for Honeymoon in February?,2,1.0,10,WeeLittleParties,weddingplanning,https://www.reddit.com/r/weddingplanning/comments/1okw48v/suggestions_for_honeymoon_in_february/,/r/weddingplanning/comments/1okw48v/suggestions_for_honeymoon_in_february/,2025-10-31 14:29:19,True,"Where to go when it's the colder ""off peak"" season, specifically in Europe, UK, or North Africa? Wearing sweaters & long pants on our trip is not a problem for us. Any other brides going somewhere fun during that time of year? Recommendations? We are not outdoor activity people (no winter sports); Our ideal vacation is a lot of fancy restaurants, bars, historical sights, museums, guided tours, etc.

We got married a few days ago, and always knew we wanted to honeymoon in February (work PTO logistics, not missing holiday season, etc). Our initial plan was a week on the island of Zanzibar off the coast of Tanzania, partly because it's close enough to the equator that even in February, it's in the mid-80s, so we wouldn't need to worry about the weather.

Fast forward to now:  We ended receiving **WAY MORE** contributions to our ""Honeymoon fund"" on Zola than we ever imagined. Our available trip budget is now $10,000! The good thing now is that we can definitely go for a much longer trip, but it's also overwhelming because of the choice paralysis of feeling like ""we can go anywhere we want!"" leading to a million possibilities  😵‍💫 🧳",<praw.models.reddit.submission.SubmissionFlair object at 0x000001BA35C3CA40>,self.weddingplanning,
1ok78cy,“That seems so expensive!” Rant,63,0.92,46,Away-Bluejay-8849,weddingplanning,https://www.reddit.com/r/weddingplanning/comments/1ok78cy/that_seems_so_expensive_rant/,/r/weddingplanning/comments/1ok78cy/that_seems_so_expensive_rant/,2025-10-30 18:13:55,True,"Got engaged in July and have been planning since then, and for the most part I’ve really enjoyed it! We both put in a good 30 hours of venue searching and after realizing how much everything is we settled on having our wedding on our personal/family property. This poses different challenges but I love having more control over the space, don’t have to be out by a certain time, can start decorating the day before, etc. 

It’s my fiancé’s family property so we’ve bounced ideas off of his grandma and mom while still trying to be the ones planning everything. Every time we mention something they say “that just seems so expensive, 30 years ago it wasn’t like that!” NO DUH! 🙃 Trying to figure out food has been the hardest, and his grandma keeps offering to cook because “it’ll be cheaper” I’m like m’am I appreciate you but you’re not looking for 100 people. I think I found something that works out to $15-20 per person, then we can do apps and sides. Yesterday his mom and grandma said “that just still seems so expensive” ….. yes, it costs $2000+ to feed 100 people…. 

My mom said the exact same thing, and I’m just like GUYS I’ve done endless research on caterers and unfortunately, things are expensive and this is the best deal that I’ve found for good food. 

My fiancé and I have talked endlessly about wanting a beach getaway honeymoon and our dream was Tahiti but it’s way out of our budget. I found a great deal through Costco for a week in Fiji for $2,300-3,500 per person including flight (depending on what package we choose) and he seemed to agree with it. So last night I said “okay do you still think Fiji is the way to go?” And  he said “yeah but that’s just a lot of money” and I kind of snapped at him and was like “well if you can find something better let me know or we can just not go on a honeymoon and save the money” 

He’s actually been so supportive and is my favorite person so maybe I’m being a bit irrational, but it just really annoyed me. We’ve spent 4 months deciding to have a wedding and that we want a honeymoon…. So it’s going to cost $15-20k minimum and that’s the reality. We already have a house, paid off cars, good jobs, savings, etc. 

I want to take the advice to just stop talking about it with other people, but that also feels isolating and overwhelming. I definitely think I’ll stop telling them prices if they ask 😂

Thank you for reading my rant and letting me vent 🩷",<praw.models.reddit.submission.SubmissionFlair object at 0x000001BA35C3CBF0>,self.weddingplanning,
1ok197j,"Sent Save the Date, getting early “no”s (call, email)",124,0.96,44,flyamanitas,weddingplanning,https://www.reddit.com/r/weddingplanning/comments/1ok197j/sent_save_the_date_getting_early_nos_call_email/,/r/weddingplanning/comments/1ok197j/sent_save_the_date_getting_early_nos_call_email/,2025-10-30 14:29:34,True,"We sent out Save the Dates in the past couple months and a few people have contacted us personally (call, email, message) to let us know they won’t be able to make it. We’re not sending invites for a few months. Our RSVP function is not open on our website, these are just people personally contacting us of their own accord to let us know they will not make it due to conflicts. 

Do we still send an invite in a few months? 

Edit because I feel like some people are misunderstanding: This is in no way a complaint that I have been told early that some people have existing conflicts. This is just trying to figure out if I can use these declines to extend invitations to other loved ones that we could not initially invite due to guest count restrictions. ",<praw.models.reddit.submission.SubmissionFlair object at 0x000001BA35C3CDA0>,self.weddingplanning,
1okyusg,"Any recent experiences going through the tux (or suit) rental process for the groomsmen? Would love to hear how it went, what you would change, all of the details!",1,1.0,2,nounsofassemblage,weddingplanning,https://www.reddit.com/r/weddingplanning/comments/1okyusg/any_recent_experiences_going_through_the_tux_or/,/r/weddingplanning/comments/1okyusg/any_recent_experiences_going_through_the_tux_or/,2025-10-31 16:14:13,True,"Before you ask... I think I have read EVERY post on this sub and others regarding this question. A lot of them are a couple years old or older, so especially curious if anyone has insight from the past year or so.

  
With so many in store and online options, I am so overwhelmed with options, and I am scared of making the ""wrong"" decision (which I know I need to get over).

I am the groom, looking at renting black tuxes for my groomsmen. Wedding is the beginning of March 2026. I am based in Dallas, so there are a lot of showrooms around that I can visit (Generation Tux, Black Tux, etc.), and of course a lot of the traditional brick and mortar stores. My groomsmen are located in different cities all around Texas.

I think reading al the reviews has done me dirty, cause while I know clearly at least a majority of people have to be having positive experience with these companies, but reddit and stuff makes it seem like nobody is! Any advice or stories from personal experience would be extremely helpful! ",<praw.models.reddit.submission.SubmissionFlair object at 0x000001BA35C3CF50>,self.weddingplanning,
1ok4wha,Who are your guests you're most impressed were able to attend?,63,0.96,40,WeeLittleParties,weddingplanning,https://www.reddit.com/r/weddingplanning/comments/1ok4wha/who_are_your_guests_youre_most_impressed_were/,/r/weddingplanning/comments/1ok4wha/who_are_your_guests_youre_most_impressed_were/,2025-10-30 16:47:22,True,"There are always so many posts on here about terrible, rude, or insane reasons that guests used as excuses to decline. But what about the opposite? Tell me about the guests who attended that you never expected to be able to make it and how they did?

For example, I've two guests, J+K, who I'd pegged for being an instant decline, for a number of understandable reasons: J+K live a 4-hour plane ride away, young parents with a 1 y/o daughter, live in a rural area with no family nearby and where childcare is scarce, and K is a doctor at the end of her medical residency in a very demanding speciality. In spite of all those reasons, they still came to our wedding! I told them how happy and humbled I was that they made it, and learned that contrary to my assumptions about the childcare factor, they said they're so used to the dreadful availability of childcare in their area that they've long ago become accustomed to just taking their daughter with them everywhere and booking childcare on-site ahead of time wherever they visit.

UPDATE: Another guest I was shocked and expected to change her RSVP last minute, my friend ""C"" told me ahead of the wedding that there was a chance she might not be able to make it if her flight was late. Our wedding is about half an hour from a major airport, and C had a previously scheduled international trip to Europe that she coincidentally had her return flight arriving early afternoon the same day as my wedding (and within only a couple hours of the start time for the ceremony, so it was gonna be a very tight window, even without a flight delay). I told her it was completely fine if she couldn't make it, but she assured me ""I will be there, I might be hopped up on energy drinks to fight off jet lag, but I will do my best!"". Not only did she make it, but she relayed to me that she threw on her cocktail dress on the plane, and put on her makeup while waiting in line at customs. I was FLOORED she did this all to attend a wedding, and hugging her so hard at the reception during our table greetings. ""Did you KNOW what C did to be here?!!!? She is a rock star"" (hugs again).

Share a happy surprise on your RSVP list!",<praw.models.reddit.submission.SubmissionFlair object at 0x000001BA35C3D100>,self.weddingplanning,
1okxfy1,What Would You Do?: DJ Issue,1,1.0,0,MusicWasMid,weddingplanning,https://www.reddit.com/r/weddingplanning/comments/1okxfy1/what_would_you_do_dj_issue/,/r/weddingplanning/comments/1okxfy1/what_would_you_do_dj_issue/,2025-10-31 15:20:47,True,"We got married last weekend and we had a less than stellar experience with our DJ. We went through a reputable DJ company in our area and were willing to pay enough to have a DJ with more than enough experience to create a memorable evening. By the end of the night and in the day's after, we can say that we had a memorable evening because of the DJ for all of the wrong reasons.

Ahead of the wedding day:

We had selected our DJ company, and specific DJ, months in advance of event. Leading up to the event we had multiple hour long meetings, both with the owner of the DJ company and the DJ himself. We came to these prepared with a pretty detailed list of our music tastes including must plays, other song reccs, and don't plays at the direction of the owner and DJ. We also worked on a schedule for the day including all of the significant songs, speakers, and events which included links to all music related items at the request of the DJ.   
  
At this point in the process, we were sure that we hit a home run with the DJ, and were sure that they were going to be a highlight of the event because of how well each of our discussions went.

The wedding day:

Unfortunately our excitement for the DJ was short lived after the ceremony and very early into the reception. From here on, I am just going to drop everything that went wrong into a bulleted list along with our level of concern related to each item next to each item to keep this short

* Did not coordinate with venue food vendors to accurately announce when food was ready. Announced cocktail appetizers were ready when they had not been brought out yet **(No biggie, appetizers came out, people were fed, and we had a good time).**
* First dance song was completely wrong. Unlike other experiences related to DJ's getting the first dance wrong that we have seen, this wasn't just a version issue. Our DJ played a song that my wife and I had never heard until the moment of our first dance. We double checked the itinerary that we had completed with the DJ to make sure that the right song was linked, and sure enough it was, the DJ just played the wrong song on the day of our wedding **(Very concerning, was a let down to not have the song we hand selected for this special moment played).**
* DJ was drinking throughout the entire event. We witnessed and heard from guests that the DJ was repeatedly visiting the open bar and drinking throughout the entire time that drinks were being served. While I gladly would have welcomed the DJ to have a couple of drinks throughout the night, it feels wrong that it was as frequent as it was in addition to the other shortcomings during the event. It also feels wrong that the DJ capitalized on the open bar when he was working the event **(Very concerning, especially since we had a hosted bar that was charged by consumption, and it feels like I paid a guy to show up and drink, while sloppily managing a spotify playlist).**
* DJ played multiple repeat songs, music that we did not recommend while not covering many of our recommend/must play songs **(Mildly concerning, I am not super fixated on the playing of music we didn't recommend, because we expected/welcomed it, but to have repeats while not getting through a good amount of our recommended songs let us down).**
* Awkward guest interactions. Multiple guests have said that the DJ was awkwardly interacting with them on the dance floor and that it was obvious that he had been drinking/observed him drinking **(Unknown level of concern, I was wanting a DJ that would be willing to do some crowd work, welcome/manage requests, but this just felt different.. no one has mentioned anything about lines being crossed (aside from him being intoxicated)).**

In the few days since, we have reached out to the owner of the DJ company, saved drafts of the communications/itinerary with song versions, and have been reaching out to guests and haven’t heard back. We were wanting to see what ideas this sub had for handling situations like this.",<praw.models.reddit.submission.SubmissionFlair object at 0x000001BA35C3D2B0>,self.weddingplanning,
1oklcxj,"If budget wasn’t an issue, where would your dream wedding or event be held?",7,1.0,33,Independent-Age3742,weddingplanning,https://www.reddit.com/r/weddingplanning/comments/1oklcxj/if_budget_wasnt_an_issue_where_would_your_dream/,/r/weddingplanning/comments/1oklcxj/if_budget_wasnt_an_issue_where_would_your_dream/,2025-10-31 04:28:42,True,"Just for fun, imagine you had an unlimited budget and could host your big day anywhere in the world. Would you pick a fairytale castle, a private beach at sunset, or maybe a cozy cabin in the woods with twinkling lights? I’d love to hear your dream location and what makes it so special to you. Bonus points if you’ve actually been to a venue like that!",<praw.models.reddit.submission.SubmissionFlair object at 0x000001BA35C3D430>,self.weddingplanning,
1okwhrp,Help please!! What kind of wedding band would look best with these rings?,1,1.0,0,Royal_Giraffe8605,weddingplanning,https://www.reddit.com/gallery/1okwhrp,/r/weddingplanning/comments/1okwhrp/help_please_what_kind_of_wedding_band_would_look/,2025-10-31 14:44:01,False,Help! What kind of wedding band would look best with these rings? One is my grandmothers (the one on my hand) and the other is one we designed! We’re deciding between the 2 and want options/advice! ,<praw.models.reddit.submission.SubmissionFlair object at 0x000001BA35C3D5E0>,reddit.com,
1ok4aop,Anyone else have experience with The Knot deleting their negative reviews?,58,0.98,25,bananascare,weddingplanning,https://www.reddit.com/r/weddingplanning/comments/1ok4aop/anyone_else_have_experience_with_the_knot/,/r/weddingplanning/comments/1ok4aop/anyone_else_have_experience_with_the_knot/,2025-10-30 16:24:53,True,"The venue I reviewed has 100% positive reviews and I wanted to share my experience to make other couples aware. 

Also, the same day I submitted my review, the vendor reached out to me (after not hearing from them for weeks) trying to make things right, but not acknowledging the review itself, which The Knot had promised me was completely anonymous. 

I’ve heard the stuff about The Knot sending bots and fake couples to vendors after those vendors paid for more leads, but I didn’t know they actually deleted bad reviews. ",<praw.models.reddit.submission.SubmissionFlair object at 0x000001BA35C3D790>,self.weddingplanning,
1okvfvl,Help me find this lace so I can make my dream dress! 🙏🏻,1,1.0,1,Ok_Salt_3904,weddingplanning,https://www.reddit.com/r/weddingplanning/comments/1okvfvl/help_me_find_this_lace_so_i_can_make_my_dream/,/r/weddingplanning/comments/1okvfvl/help_me_find_this_lace_so_i_can_make_my_dream/,2025-10-31 14:02:13,True,"Hello!! I’m a young bride so budgeting and saving where we can is HUGE. Our wedding is March 7th. 🥹 I went wedding dress shopping and recently fell in love with this dress though… that’s $4,000 not including alterations and add-ons (I’m adding off the shoulder straps).  

It’s the Martina Liana, 1882-L, Ivory.

I LOVEE this dress however that’s way more than I want to spend on a dress. I have a talented seamstress who will make me a replica of the dress but now we need to track down what lace this is. This is the only lace that I have ever liked. 

If someone could me find this lace so I can start having the dress get made before March, that would be amazing!! 🙏🏻",<praw.models.reddit.submission.SubmissionFlair object at 0x000001BA35C3D940>,self.weddingplanning,
