id,title,score,upvote_ratio,num_comments,author,subreddit,url,permalink,created_utc,is_self,text,flair,domain,search_query
1oleklg,Monthly Check In....it's November 2025,7,1.0,42,AutoModerator,weddingplanning,https://www.reddit.com/r/weddingplanning/comments/1oleklg/monthly_check_inits_november_2025/,/r/weddingplanning/comments/1oleklg/monthly_check_inits_november_2025/,2025-11-01 04:00:43,True,"How's it going? Posts are organized by month as far as 18 months out. Add where needed!

Also check out the [Daily Chat](https://www.reddit.com/r/weddingplanning/search/?q=daily%20chat&restrict_sr=1&t=day), which is a great place for quick questions and casual chatting.",<praw.models.reddit.submission.SubmissionFlair object at 0x000001BA34BA1430>,self.weddingplanning,
1om7rjw,"Daily Chat & Quick Questions - November 02, 2025",1,1.0,0,AutoModerator,weddingplanning,https://www.reddit.com/r/weddingplanning/comments/1om7rjw/daily_chat_quick_questions_november_02_2025/,/r/weddingplanning/comments/1om7rjw/daily_chat_quick_questions_november_02_2025/,2025-11-02 04:01:55,True,"Discuss anything on your mind with your fellow wedditors. This is an especially great place to ask short (1-2 lines) questions or commonly asked questions instead of making an individual post.

All discounts and deals should be posted here.

Don't forget to check out the latest Monthly [Check In thread](https://www.reddit.com/r/weddingplanning/search?q=title%3Acheck+in&restrict_sr=on&sort=new&t=month)! The Monthly Check In is great for finding date twins, as well as seeing where others are at in their ""To Do"" timelines.",<praw.models.reddit.submission.SubmissionFlair object at 0x000001BA34BA0320>,self.weddingplanning,
1om1047,My best friend of 11 years hasn't asked me to be a bridesmaid..,99,0.85,57,Poorfunctioningwoman,weddingplanning,https://www.reddit.com/r/weddingplanning/comments/1om1047/my_best_friend_of_11_years_hasnt_asked_me_to_be_a/,/r/weddingplanning/comments/1om1047/my_best_friend_of_11_years_hasnt_asked_me_to_be_a/,2025-11-01 22:29:29,True,"Hi there so my best friend is getting married in a few months. We have been through so much together and supported each other in all our lows and highs. She told me she wasn't having bridesmaids which is fair enough, then she texted me after making a hen group chat personally saying she can't afford another bridesmaid but asked 3 other friends. I am ao incredibly hurt and feel like I shouldn't go to her wedding based on this. 

I asked her to be mine for my wedding and she said no, so I feel a little backstabbed and extremely hurt. We have been best friends since school, and the fact she has done this as seriously made me questioned going or not.

Am I wrong to feel like this? I honestly feel awful 😖 ",<praw.models.reddit.submission.SubmissionFlair object at 0x000001BA32C746E0>,self.weddingplanning,
1olt96y,How am I supposed to come up with a realistic wedding budget if no vendors will disclose their prices?,106,0.98,51,bananascare,weddingplanning,https://www.reddit.com/r/weddingplanning/comments/1olt96y/how_am_i_supposed_to_come_up_with_a_realistic/,/r/weddingplanning/comments/1olt96y/how_am_i_supposed_to_come_up_with_a_realistic/,2025-11-01 17:12:14,True,"I’m at a bit of an impasse because I don’t want to book any vendors until I have a very general sense of how much this wedding is going to cost. Once I have established my overall budget and know what’s realistic for me, I’ll be able to feel good about booking vendors within my price range. 

Here’s what I’ve done so far to try to get a feel for how much I should be budgeting for each vendor:

1. Pricing listed on vendor search engines like Zola and The Knot are wildly different from the few prices I’ve received from vendors. 

2. When I ask people who got married 2+ years ago, they think everything I’m telling them is absolutely insane because it costs more than it did when they got married. Unfortunately, I don’t control the wedding industrial complex so it’s not really my fault that weddings are expensive. 

3. I’ve already reached out to several different types of vendors (venues, photographers, caterers, rental companies). They will not give me a price range until I sit down with them and have lengthy meetings selecting exactly what I want. While I understand that every client’s needs are different, all I’m seeking right now is a very general range.

Does it really benefit vendors to not disclose anything about their general price range? Do they think that wasting potential clients’ (and their own) time by making people sit through meetings before they even know if they can afford that vendor is a good thing for their business? ",<praw.models.reddit.submission.SubmissionFlair object at 0x000001BA35C43E30>,self.weddingplanning,
1om7bzh,"A cheap, easy favor…",12,0.93,2,clangin813,weddingplanning,https://www.reddit.com/r/weddingplanning/comments/1om7bzh/a_cheap_easy_favor/,/r/weddingplanning/comments/1om7bzh/a_cheap_easy_favor/,2025-11-02 03:37:13,True,"I just worked a wedding where the favor was his and hers favorites snacks. Hers was buttered popcorn. His was chocolate covered pretzels. Buy in bulk, repack with a cute label. Every single one was taken home. I could see this being done with soooo many snacks. And who doesn’t want to much on something salty/sweet after drinking ",<praw.models.reddit.submission.SubmissionFlair object at 0x000001BA36E08050>,self.weddingplanning,
1om153p,Should I put my brother’s girlfriend’s name on his invitation?,17,0.76,42,Define-Dancing,weddingplanning,https://www.reddit.com/r/weddingplanning/comments/1om153p/should_i_put_my_brothers_girlfriends_name_on_his/,/r/weddingplanning/comments/1om153p/should_i_put_my_brothers_girlfriends_name_on_his/,2025-11-01 22:35:31,True,"Not sure on the etiquette of this. He’s allowed to bring her as he gets a plus one, of course. I’m just not certain about putting her name on the invite. They’ve been together for less than a year, and by the wedding it will still be for less than a year (if that matters) and uh… let’s just say the jury is definitely still out on whether or not he wants this to be a long term thing. 

Just double checking because she’s not been super popular with my fiancé, my family, and I, and I don’t know if I’m just being an ass lol. I’d just prefer to put “‘Brother’s Name’ and Guest” or however you’re supposed to put it, just not sure if that’s allowed or too rude or something. ",<praw.models.reddit.submission.SubmissionFlair object at 0x000001BA36E081D0>,self.weddingplanning,
1olnjye,Thoughts on vendors who call their pricing page “investment”?  Is this a new trend or is this the norm?,73,0.97,57,aishpat,weddingplanning,https://www.reddit.com/r/weddingplanning/comments/1olnjye/thoughts_on_vendors_who_call_their_pricing_page/,/r/weddingplanning/comments/1olnjye/thoughts_on_vendors_who_call_their_pricing_page/,2025-11-01 13:15:30,True,For some reason it strikes me as overly pretentious. I find this off putting and have been eliminating them.,<praw.models.reddit.submission.SubmissionFlair object at 0x000001BA36E084A0>,self.weddingplanning,
1om1gfd,What’s one thing I shouldn’t cheap out on?,13,0.89,31,Parking-Ear-8255,weddingplanning,https://www.reddit.com/r/weddingplanning/comments/1om1gfd/whats_one_thing_i_shouldnt_cheap_out_on/,/r/weddingplanning/comments/1om1gfd/whats_one_thing_i_shouldnt_cheap_out_on/,2025-11-01 22:49:25,True,Hello! Future 2026 bride here :) currently planning and trying to budget.. what’s one thing I absolutely should NOT cheap out on? ,<praw.models.reddit.submission.SubmissionFlair object at 0x000001BA36E08650>,self.weddingplanning,
1olwewa,Feeling Defeated,16,0.94,33,Mcnuggetqueen,weddingplanning,https://www.reddit.com/r/weddingplanning/comments/1olwewa/feeling_defeated/,/r/weddingplanning/comments/1olwewa/feeling_defeated/,2025-11-01 19:18:09,True,"I have always dreamed of having a wedding. Nothing over the top, but something elegant and special. I’ve been looking at venues in Dallas/Fort Worth and Austin and truthfully I’m not able to find anything I love within our venue budget. I don’t like barn/ranch style and there’s an overwhelming amount of those venues in Texas.

We have 30K to work with and it’s just looking like things aren’t to go how I had dreamed. Many of our family and friends are coming from out of town, so Saturday is the most ideal. But with that comes a large surge in pricing. 

For brides with a smaller budget, how did you make things work! And were you truly happy with the outcome?",<praw.models.reddit.submission.SubmissionFlair object at 0x000001BA36E089E0>,self.weddingplanning,
1olrg3r,Do Not Hire James Alexander Films (Blue Sage / Goldtone Films) - Our Wedding Photographer Nightmare,29,0.95,6,sweeetlime_,weddingplanning,https://www.reddit.com/r/weddingplanning/comments/1olrg3r/do_not_hire_james_alexander_films_blue_sage/,/r/weddingplanning/comments/1olrg3r/do_not_hire_james_alexander_films_blue_sage/,2025-11-01 16:00:00,True,"I don’t know how many people will read this, but I need to share our story to warn others about James and his many businesses (James Alexander Films, Blue Sage Films, and Goldtone Films) to try to get some accountability. I apologize in advance that this is really long, but I feel like sharing our entire experience with this man is important. 

My husband and I trusted James with one of the most important days of our lives, and what we experienced was manipulative, dishonest, and deeply unsettling. He lies easily, gaslights when confronted, and uses intimidation to deflect responsibility. Because of him, we still don’t have most of the photos and videos from our wedding more than a year later.

Our wedding was in the United States, but James is based in the UK and most of his clients are there. He advertises himself as splitting time between LA and London. This post is especially for anyone in the UK considering hiring him under any of his business names: James Alexander Films, Blue Sage Films, or Goldtone Films. 

His related Instagram accounts include:

1. jamesalexander1

2. jamesalexanderfilm

3. goldtonefilms

4. jimmy\_69\_james

5. desertpalmprints

I first contacted James in February 2024, about two weeks after we got engaged. I found him through an ad on Instagram and was immediately drawn to his artistic, documentary style and his use of Super 8 film, which I had dreamed of having for years. That was the deciding factor for me.

From the very beginning, communication was inconsistent and confusing, scattered between Instagram, email, and WhatsApp. He was constantly online but would take days to respond, often replying to only part of what I would ask or message about. Still, we wanted to give him the benefit of the doubt and tried to be understanding, assuming that his delays and partial responses were due to his busy schedule.

We signed our contract on March 31, 2024 (James signed April 1st). On May 31st, he offered a “special” deal if we paid the remaining balance early: a small discount plus a free pre-wedding shoot. My husband and I hesitated but eventually agreed, paying in two parts on June 15th and July 3rd. I later learned he made this same “early payment for perks” offer to several other couples.

For months, we tried to schedule the pre-wedding shoot. Each time we reached out, he ignored messages and left us on read, said he was too busy, traveling, didn’t have internet access, was on set, or working other weddings. I expressed concern about the communication more than once, but he always had an excuse, acted confused about what I was referring to, or continued to gave partial answers that left most of my message unaddressed. When we realized it wouldn’t happen before the wedding, we agreed to postpone it until afterward.

An important note: we were getting married at the Santa Barbara courthouse. To get married there, you have to schedule an appointment and can only be booked three months in advance. Because of this, we worked closely with all of our vendors, but specifically James so they understood our desired date wouldn’t be set for a few months before the wedding. So we drafted our own contract to protect ourselves in case we couldn’t secure our desired October date. James agreed to all of our terms, which included clear protections around refunds, ownership, and sharing rights:

* “The clients will receive a full refund of the booking fee and any balance paid towards the booking if the date changes and the photographer cannot accommodate the new date.” 
* “The clients retain ownership and copyright of all photos and videos produced.” 
* “A photo release must be executed by the clients before any publication of photos or videos online or in print.” 

At the time, these provisions felt like necessary precautions to protect our wedding and our memories. Looking back now, they have become the strongest evidence of how completely James has disregarded the agreement.

Despite these red flags, we moved forward with him because we loved his work, believed he would deliver the images and videos we had paid for, and were drawn to the Super 8, which was probably the most important to us. We were trying to give him as much grace and patience as we could, hoping that the inconsistencies and delays weren’t an actual reflection of his reliability.

The day before our wedding, my husband and I actually joked that James might not show up at all. We genuinely wondered if we might have been scammed, given the way things had gone up to that point. When he did show up, we were beyond relieved and excited. He was the photographer we had chosen and someone whose style we genuinely loved. Despite the red flags leading up to the day, we wanted to move past the initial hiccups and focus on enjoying our wedding.

On the day, we had a great time with James. The only issue we had was that he gave almost no direction, even though he had promised he would, which was difficult for us because we both get nervous in front of a camera. Months later, my sister told me that James had been drinking leftover mimosas from the wedding party before heading to the courthouse, even though we had offered him his own mimosa that he had declined. I found this news incredibly bizarre and somehow entirely in line with the rest of his behavior that would follow.

Two days after the ceremony, he posted photos and video clips from our wedding on Instagram. While we were excited to see previews, our contract explicitly required written permission before anything could be shared publicly. We included this clause because we felt somewhat uneasy with James potentially promoting himself/his work with our pictures given the difficulties we had with him prior to our wedding. When we saw the images posted a few days after our wedding, we didn’t make an issue of it because we were still excited and assumed we’d be getting our full gallery soon. Weeks passed with no updates. When I finally reached out about the timeline for deliverables, specifically the RAW images. My messages were left on read.

In December, we finally received an online gallery, but found that key moments were missing: getting-ready shots, photos with family, and almost everything from our reception. Some photos were duplicated or showed people mid-blink or yawning. Out of the 700+ edited images promised in our contract, we received fewer than 500.

We were also supposed to receive:

* All RAW images from the day 
* Camcorder footage (edited and unedited) 
* Super 8 film (edited and unedited) 
* 35 mm film scans and prints 
* The pre-wedding shoot 

None of those were included.

When we asked James about the missing or less than great images, he claimed he “chose the best,” and the excuses began. At the beginning, each excuse seemed totally plausible and we in-turn respond with understanding, but as we continued to only be met with excuses, the pattern of manipulation became clear.

After receiving our gallery, I reached out inquiring about the remaining deliverables, specifically the Super 8, and James told me there was a queue because of the holidays and that we would get it in early 2025. At the time, that seemed completely reasonable and we would just be patient. I reached out again in February after not receiving any further updates, again asking specifically about the Super 8. His response was the same, there was still a queue.

In April 2025, after another round of chasing him down, he suddenly told us there had been a mix-up at the lab, but offered no details or explanation about what the supposed mix-up was, despite us worrying that our irreplaceable Super 8 might have been damaged or destroyed. Over this time, he also mentioned that he had underestimated the cost or processing time for the Super 8, but when I looked it up, I found that processing typically takes no longer than four weeks and costs at most $100. Even with a generous estimate accounting for a massive queue, processing should not have taken more than three months, and what we paid would’ve covered any increased or surprise costs.

July 2025, after 9 months of delays, unanswered messages, and repeated excuses, I had reached my breaking point. I demanded the remaining deliverables, hoping to finally get everything we were owed. Instead of simply providing them, James responded with yet another excuse. He claimed he had been hospitalized recently and said that was the reason for the continued delays. When I first heard this, it completely gave me pause. I believed him but a part of me started questioning whether it was true, which lead to guilt. Who would lie about a hospitalization? He had given so many excuses and reassurances before this that never lead to anything that it became impossible to know what was true and what wasn’t. But that is exactly the kind of manipulation James relies on. He twists situations, creates confusion, and makes you question yourself so that you stop pushing for accountability.

At the same time, I began connecting with other couples who had hired him. I quickly found over a dozen who described the same experience: poor communication, undelivered work, endless excuses, and being ghosted after full payment. Every story matched ours almost exactly. We created a group chat to share information, and the similarities were undeniable. Later, I learned that, whether or not the hospitalization was real, he only ever mentioned it to other couples after they chased him for deliverables. He never shared it proactively or as part of transparent communication. The queue, the lab mix-up, and the hospitalization were never about keeping clients informed; they were tools to deflect, postpone, and avoid responsibility.

When James realized that we were connecting the dots and that his reputation might be at risk, he blocked me on all but one of his Instagram profiles, to include the one that was our primary form of communication, but he finally sent a Google Drive link containing some of the RAW photos. When I opened it, I saw that the files had actually been uploaded on our wedding day. He had them all along and chose to withhold them for nearly a year. Even then, huge sections were missing, most noticeably pictures of family. This was a perfect example of how he manipulates clients. He provides just enough to appease you while still controlling and withholding what you are owed, keeping you off balance, confused, and unsure how to respond.

James has a consistent pattern of pretending not to remember previous conversations, rewriting timelines, giving contradictory explanations, and providing partial answers designed to create confusion rather than resolution. Around this same time, after I began warning others about him, James sent me a threatening message that included an article about a photographer who deleted a couple’s wedding photos because they didn’t feed him. He implied he might do the same to us, while falsely claiming we hadn’t provided him with food or breaks, which was completely untrue. We had made sure he was comfortable, fed, and taken care of throughout the entire day. The message was manipulative and clearly intended to intimidate.

As of now, October 2025, more than a year after our wedding, we have finally received part of the camcorder footage: one edited video and a few unedited clips, but a large portion is still missing. 

We are still waiting for:

* Remaining RAW images 
* Super 8 film (edited and unedited) 
* 35 mm scans and prints 
* Remaining unedited camcorder footage 
* $750 refund for the unfulfilled pre-wedding shoot and the missing edited images 

James has violated our signed contract, our trust, and expectations of basic professional conduct. Despite repeated follow-ups and assurances, he continues to withhold what we paid for, leaving us without the full memories of our wedding day.

It’s taken me a full year to work up the nerve to speak about this publicly. I stayed silent for so long because I was embarrassed that I ignored so many red flags, believing that James would eventually do the right thing. I see now that was never going to happen. Staying quiet only protected him, and he’s the last person who deserves that kind of grace.

At this point, this is about accountability and making sure others don’t go through the same experience. I’ve looked into small claims and bank disputes, but because he’s based in the UK and we’re in California, it’s complicated, and none of it stops him from continuing to do this to others. It also doesn’t get us what we’re still owed.

Despite everything, we’re still hoping James will deliver what we paid for and what our contract guarantees. I’m sharing this because I know how convincing his marketing is and how heartbreaking it is to be left without your wedding memories. If you’re considering hiring him under any of his business names, please reconsider. And if this has happened to you too, know that you’re not alone. Many of us are still fighting to get what we were promised.

Thank you to everyone who’s made it this far into this post and to the other poster who already spoke on their experience with James in this sub. Seeing yet another person speak up helped me realize that more of us need to speak out publicly as well. If you’ve also worked with him and had a similar experience, please reach out. The more we share, the harder it will be for him to continue doing this.

If you can, please help boost this post by sharing or commenting so it reaches others before they go through what we did.",<praw.models.reddit.submission.SubmissionFlair object at 0x000001BA36E08B90>,self.weddingplanning,
1olryfa,How early is too early to start planning?,19,0.86,57,MobileMaintenance883,weddingplanning,https://www.reddit.com/r/weddingplanning/comments/1olryfa/how_early_is_too_early_to_start_planning/,/r/weddingplanning/comments/1olryfa/how_early_is_too_early_to_start_planning/,2025-11-01 16:20:18,True,"I just got engaged this week and we are really wanting to get married in fall of 2026. What do I do first?! I’m so overwhelmed - it feels crazy to start planning stuff already but if we’re aiming for less than a year out, is it really that crazy to start? I’m guessing first thing is to reach out to venues for tours so we can nail down a date. Again I’m just overwhelmed (in a good way! lol) ",<praw.models.reddit.submission.SubmissionFlair object at 0x000001BA36E08D40>,self.weddingplanning,
