id,title,score,upvote_ratio,num_comments,author,subreddit,url,permalink,created_utc,is_self,text,flair,domain,search_query
1oh8azs,What’s one wedding detail or vendor you’re so glad you didn’t skip? 💍,1,0.6,0,Independent-Age3742,Weddingsunder10k,/r/weddings/comments/1oh814t/whats_one_wedding_detail_or_vendor_youre_so_glad/,/r/Weddingsunder10k/comments/1oh8azs/whats_one_wedding_detail_or_vendor_youre_so_glad/,2025-10-27 07:41:19,False,,<praw.models.reddit.submission.SubmissionFlair object at 0x000001BA36EA9B80>,,
1ogtu2o,(10k budget) Advice for doing own wedding makeup and hair?,9,0.91,12,mountain_dweller_co,Weddingsunder10k,https://i.redd.it/hkvazmqgeixf1.jpeg,/r/Weddingsunder10k/comments/1ogtu2o/10k_budget_advice_for_doing_own_wedding_makeup/,2025-10-26 19:39:55,False,"Hi there! We are hoping to not spend more than 10k on our wedding. We live in the Colorado mountains and many of our guests will be traveling here to celebrate with us. We are planning on having some fun things for our guests to do with us while they are in town and a big portion of our budget will go to feeding them as much as we can and as well as we can! That being said, I’m looking to cut costs where possible and am hoping to do my own makeup and possibly hair. But I don’t know where to start!! I don’t really wear any makeup but am very artistic and when I used to wear makeup I did a good job with liquid eyeliner and the likes. Anyway, I’d love some advice or tips on doing my own makeup. And even help on where to begin. I plan on wearing my long hair down as well, so I don’t think I’d need much work on my hair. Anyway, any help/advice is so much appreciated!!! Pic of venue included because pics always make things nice :)",<praw.models.reddit.submission.SubmissionFlair object at 0x000001BA36EA9E20>,i.redd.it,
1ogs5yl,(5k) awesome dinnerware find!,11,0.87,2,TheModernVampire,Weddingsunder10k,https://i.redd.it/fmfxveqo2ixf1.jpeg,/r/Weddingsunder10k/comments/1ogs5yl/5k_awesome_dinnerware_find/,2025-10-26 18:33:55,False,"Just super excited about this marketace find! Around 200 pieces of Anchor Landing Royal Ruby pieces! Sold for way cheaper than it could've gone for. 

Now just to find flatware to go with it!

(Ft. The void kitten lurking)",<praw.models.reddit.submission.SubmissionFlair object at 0x000001BA36EA9FA0>,i.redd.it,
1ogqoft,Free - Central Florida Decor Giveaway,14,0.94,7,holachihuahua,Weddingsunder10k,https://www.reddit.com/gallery/1ogqoft,/r/Weddingsunder10k/comments/1ogqoft/free_central_florida_decor_giveaway/,2025-10-26 17:36:14,False,"I would like to pay it forward and help reduce one worry from someone. Willing to meet Brevard, east Orange, south Volusia counties.

Decor 

Reserved signs (2)
Easel (1)
Cards & Gifts sign (1)
Please sign our guest book sign (1)
Mr & Mrs wooden cutouts
LED candles (16)
Glass vases blues/browns/amber
Pampas/feathers 
Table numbers (20) and holders (16)


",<praw.models.reddit.submission.SubmissionFlair object at 0x000001BA36EAA120>,reddit.com,
1ofyniw,"($18k) Cheese wheels cost less than traditional wedding cake - Our ""cheese cake"" was a huge hit!",777,0.99,35,RikuKat,Weddingsunder10k,https://i.redd.it/jq04b3druaxf1.png,/r/Weddingsunder10k/comments/1ofyniw/18k_cheese_wheels_cost_less_than_traditional/,2025-10-25 18:19:29,False,"I don't have much of a sweet tooth, so this was a perfect solution-- and one that was highly complimented by our guests! I went through a local business who only marked up the wheels slightly above the price they purchase them at. 

We also had a cookie table that was loaded with cookies my ""aunties"" baked for us, so there were still sweet items for those who wanted them!",<praw.models.reddit.submission.SubmissionFlair object at 0x000001BA36EAA720>,i.redd.it,
1og57zl,(20k) Wedding food?,37,0.92,55,megansomebacon,Weddingsunder10k,https://www.reddit.com/r/Weddingsunder10k/comments/1og57zl/20k_wedding_food/,/r/Weddingsunder10k/comments/1og57zl/20k_wedding_food/,2025-10-25 23:00:27,True,"Im getting insane sticker shock. Planning for 80 people. The cheapest caterer quote we've gotten for a basic, mid range dinner is 15k! Each time, the food only accounts for 4k of the cost. The rest is labor, equipment, and fees.I just don't understand how people afford this!

For reference, my fiance is an in n out manager and we wanted to get catering from their event truck, but they don't service our area. They said if we pay for travel and hotel in addition to the food and staffing the event, it would be 18k. How can that cost be 18k including hotel stays and travel, but a caterer down the road needs 15k??

I must be missing something. Should I be looking at local food trucks? Is there a trick to finding caterers at a lower budget at all? Or am I destined to spend nearly my entire budget on food?",<praw.models.reddit.submission.SubmissionFlair object at 0x000001BA36EAA960>,self.Weddingsunder10k,
1oh54z4,(10K) Most guests at the engagement party are not invited to the wedding.,0,0.2,25,Pinkcountersink,Weddingsunder10k,https://www.reddit.com/r/Weddingsunder10k/comments/1oh54z4/10k_most_guests_at_the_engagement_party_are_not/,/r/Weddingsunder10k/comments/1oh54z4/10k_most_guests_at_the_engagement_party_are_not/,2025-10-27 04:18:49,True,"I am not planning on inviting over 2/3 of the guests at my engagement party to my wedding. (Full explanation below if you are interested in why, I swear there's a good reason) 

Does anyone have any advice on how to inform people who may ask that they are not invited to the wedding?

Should I wait for people to ask for a wedding invite or make it immediately clear that just because you were invited to the engagement party does not mean you're invited to the wedding? 

--- 
Explanation: 

I am American and my fiance is German. I plan on getting married in Europe because I'll be moving back over there at the end of the year. 

I can't afford to buy plane tickets for all of my family to come over to Europe for the wedding. But most of my close family (mainly my siblings) plus a majority of my friends cannot afford plane tickets on their own. 

I'm planning a more involved engagement party in America that my American family will be able to attend. Unfortunately, that means that my fiance's family in Germany (apart from his parents) will miss the engagement party! 

That's why we're having two events, because either one side of the family gets left out or the other. 

My family is a LOT larger then my fiance's, which means the wedding in Europe will likely be pretty small and mostly filled with his family members.


That being said, the cost per head for the engagement party is really low. There's not as many expectations for an engagement party so I was able to skip out on a lot of the more expensive items. This means that I can afford to invite a lot more family than I would for the wedding. 

I'm now in a predicament where a bunch of my family and friends are coming to the engagement party who either A) Wouldn't be able to get to Europe for a destination wedding or B) Wouldn't have received an invitation for the wedding in the first place because I'm not as close with them. 

I don't want tell these people like "" Oh hey! Thanks for coming to the engagement party. You're my second great aunt who I've only spoken to once that my grandmother asked to invite you here, and I can afford to have you at this Engagement Party but not my destination wedding in Europe, so please don't expect a wedding invitation""

Or say ""Thanks for coming. Here is an invitation to a wedding I know you likely can't afford to attend."" 

Like.... 

What do I do :( 

",<praw.models.reddit.submission.SubmissionFlair object at 0x000001BA36EAAAE0>,self.Weddingsunder10k,
1ogje9o,Help with set up?,3,1.0,3,Ptaylordactyl_,Weddingsunder10k,https://www.reddit.com/r/Weddingsunder10k/comments/1ogje9o/help_with_set_up/,/r/Weddingsunder10k/comments/1ogje9o/help_with_set_up/,2025-10-26 12:29:08,True,"Has anyone been able to find vendors that do just set up of decor and not full day coordination? I just need someone to be there to set up for 2 hours, thinking of putting a FB post out to see if any college girls are interested In doing it. ",<praw.models.reddit.submission.SubmissionFlair object at 0x000001BA36EAAC60>,self.Weddingsunder10k,
1l4loh7,Community is again active and open for questions or discussions!,2,1.0,6,psprady,weddings,https://www.reddit.com/r/weddings/comments/1l4loh7/community_is_again_active_and_open_for_questions/,/r/weddings/comments/1l4loh7/community_is_again_active_and_open_for_questions/,2025-06-06 06:35:41,True,,<praw.models.reddit.submission.SubmissionFlair object at 0x000001BA34C289E0>,self.weddings,
1ol7vhg,"Today on All Hallows Eve, my fiancée finally became my wife",246,0.98,32,NerdyPuddinCup,weddings,https://i.redd.it/k7oo4kpxuiyf1.jpeg,/r/weddings/comments/1ol7vhg/today_on_all_hallows_eve_my_fiancée_finally/,2025-10-31 22:16:22,False,,<praw.models.reddit.submission.SubmissionFlair object at 0x000001BA36EE1310>,i.redd.it,
1oln9of,Bridesmaid in 2nd wedding gift,1,0.56,13,foreverlaur,weddings,https://www.reddit.com/r/weddings/comments/1oln9of/bridesmaid_in_2nd_wedding_gift/,/r/weddings/comments/1oln9of/bridesmaid_in_2nd_wedding_gift/,2025-11-01 13:02:20,True,"One of my long time best friends is getting remarried. I was a bridesmaid in her first wedding back in 2010 and I'm a bridesmaid in this wedding. She didn't do a bachelorette party this time around. This is a small wedding and a lot of DIY. We're setting up the tables and chairs at the reception, putting on table clothes, doing the flower arrangements and center pieces, doing the bouquets, etc. I'm the lone out of town bridesmaid so I'm also getting a place to stay for 2 nights. I'm not bringing my family. My only expenses are travel, dress, shoes, and lodging. I know everyone gifts a different amount but I'm looking for more of a general more or less than usual in this case type of vibe I guess. Thanks!! ",<praw.models.reddit.submission.SubmissionFlair object at 0x000001BA36EE12E0>,self.weddings,
1okzpgk,Loving this Bridesmaid Dress!,10,0.75,4,TeaDimSum53,weddings,https://i.redd.it/ri4xrec28hyf1.jpeg,/r/weddings/comments/1okzpgk/loving_this_bridesmaid_dress/,2025-10-31 16:46:41,False,,<praw.models.reddit.submission.SubmissionFlair object at 0x000001BA36EE1280>,i.redd.it,
1olax6z,Suggestion: Get a Complete Family Photo at Your Reception!,2,1.0,4,Salty_Thing3144,weddings,https://www.reddit.com/r/weddings/comments/1olax6z/suggestion_get_a_complete_family_photo_at_your/,/r/weddings/comments/1olax6z/suggestion_get_a_complete_family_photo_at_your/,2025-11-01 00:42:02,True,"Weddings and funerals are sometimes the only time that all, or at least most, of the relatives assemble together.

Gather the parents, grandparents, great-grandparents, aunts, uncles, cousins, nieces, nephews and in-laws together, and ask your photographer to take a complete family photo!

You will be glad you captured great-great-grandpa in the last year of his life, adorable cousin Jack before his tragic accident - and it makes a great and meaningful gift later.",<praw.models.reddit.submission.SubmissionFlair object at 0x000001BA36EE11F0>,self.weddings,
1okngay,How are people actually affording weddings in 2025? 😭,37,0.73,246,usaamazonseller,weddings,https://www.reddit.com/r/weddings/comments/1okngay/how_are_people_actually_affording_weddings_in_2025/,/r/weddings/comments/1okngay/how_are_people_actually_affording_weddings_in_2025/,2025-10-31 06:39:05,True,"We just started planning and almost fainted seeing venue pricing.  
If you’re already married — what’s *one money saving trick* that helped you the most?  
We want a beautiful day, but not lifelong debt 😅",<praw.models.reddit.submission.SubmissionFlair object at 0x000001BA36EE11C0>,self.weddings,
1ok1ncn,Literally HOW do people pay for weddings,229,0.87,638,Infinite-Flow4120,weddings,https://www.reddit.com/r/weddings/comments/1ok1ncn/literally_how_do_people_pay_for_weddings/,/r/weddings/comments/1ok1ncn/literally_how_do_people_pay_for_weddings/,2025-10-30 14:45:03,True,"Just got a price from a venue, and most around us are the same, and the venue alone is between 13-15k????! And if I want food and beverage it's upwards of 18-30k!!???!!? WTF HOW DO YALL DO IT ",<praw.models.reddit.submission.SubmissionFlair object at 0x000001BA36EE1190>,self.weddings,
1okmpir,Go with established florist or take a chance on new business?,1,1.0,6,DisastrousZebra4173,weddings,https://www.reddit.com/r/weddings/comments/1okmpir/go_with_established_florist_or_take_a_chance_on/,/r/weddings/comments/1okmpir/go_with_established_florist_or_take_a_chance_on/,2025-10-31 05:49:49,True,"Currently torn between two floral quotes - one is from an established, well-reviewed and recommended florist who has worked with our venue often. Her work is stunning but pricey. I am 100% confident she would do an exceptional job. 

The other florist is actually my wedding planner — she currently works for our wedding planning company but is just starting a side business as a florist (no storefront or anything yet). Since she’s just starting off, her prices are A LOT lower. Like I could get double the amount of floral pieces for the same price. She’s a great wedding planner and I’ve been blunt asking if there would be any conflict with her being both our wedding planner and our florist and her plans for covering the workload. She had a solid plan already outlined and confident answers. I like the idea that as my planner, she’s fully integrated with all elements of our wedding. However, I’m torn between going with the established florist and getting way less flowers or taking a gamble on a newer business that’s less established and hasn’t done many large weddings. 

For reference, our budget is 7.5k so it’s a sizable amount of florals. Both have given me quotes within that budget, so it’s just a choice of how much impact I want florals to make (and I would love to have lots and lots of florals)

",<praw.models.reddit.submission.SubmissionFlair object at 0x000001BA36EE1160>,self.weddings,
1ok3og9,Did you know many of the most common wedding traditions actually started as ways to scare off evil spirits?,9,0.81,2,wedgewoodweddings,weddings,https://www.reddit.com/r/weddings/comments/1ok3og9/did_you_know_many_of_the_most_common_wedding/,/r/weddings/comments/1ok3og9/did_you_know_many_of_the_most_common_wedding/,2025-10-30 16:02:12,True,"Back in the day, bridesmaids didn’t just dress alike for the photos, they all wore matching outfits on purpose as decoys so evil spirits couldn’t tell who the real bride was. The veil wasn’t just for modesty either, it was meant to protect her from bad energy.

And the bouquet? This one surprised me the most. Back in time, brides carried garlic, herbs, and spices for protection on their wedding day, and then eventually started adding flowers to mask the smell. Over time, those herbal charms turned into the beautiful floral bouquets we know today.

Even the old “tin cans on the car” tradition had a spooky origin, the noise was supposed to scare away any lingering spirits as the couple drove off into married life.

It’s funny how all these superstitions slowly became the sweet traditions we still love. The bouquet one always gets me, who knew something meant to chase off spirits would become such a beautiful keepsake?",<praw.models.reddit.submission.SubmissionFlair object at 0x000001BA36EE1130>,self.weddings,
1ok6elu,Help! I need heel recs for my f*cked up feet,5,0.86,26,fuckeduporfarfaraway,weddings,https://www.reddit.com/r/weddings/comments/1ok6elu/help_i_need_heel_recs_for_my_fcked_up_feet/,/r/weddings/comments/1ok6elu/help_i_need_heel_recs_for_my_fcked_up_feet/,2025-10-30 17:43:16,True,"I’m getting married next summer and my fiancé is one entire foot taller than me, so I’d like to wear heels at least 3 inches (being closer in height honestly just makes it easier to kiss and dance). Unfortunately, I have a bunion on one foot, which is pretty small, but any heeled sandal with a strap that goes over it is painful the second I put them on. I also have pretty high arches, and maybe related to that, a high instep, so anything with a rigid piece over the top of my foot is pretty tough. I’m wondering if anyone has any suggestions for white/blush/light blue/silver heels, ideally 3 inches or taller? Brands to look at, styles to look out for, or specific shoes would be so helpful! I also love a platform and or thicker/supportive heel. I tried Larroude, which claims to make comfortable heels but the material was so rigid and almost sharp at the edges that my bunion was not happy.

I’d be so grateful for any help or suggestions!! 🙏",<praw.models.reddit.submission.SubmissionFlair object at 0x000001BA36EE1100>,self.weddings,
1ok4ras,Venue requires wedding insurance. What coverage and how much did you pay?,5,0.86,10,Flashy_Hat_9264,weddings,https://www.reddit.com/r/weddings/comments/1ok4ras/venue_requires_wedding_insurance_what_coverage/,/r/weddings/comments/1ok4ras/venue_requires_wedding_insurance_what_coverage/,2025-10-30 16:42:04,True,"Hi weddit!  
  
Our venue is making us get liability insurance before the big day. I'm seeing options from like $75 for basic liability to a few hundred if you add cancellation coverage. We've got about 120 guests if that matters.  
For people who dealt with this, who did you end up choosing? Just the basic liability or did you add cancellation plan too? Wanna know whats required and what not. Any advice would be helpful,  
  
thanks in advance!!",<praw.models.reddit.submission.SubmissionFlair object at 0x000001BA36EE10D0>,self.weddings,
1ojhaq7,Advice needed,49,0.75,313,throwaway8263914,weddings,https://www.reddit.com/r/weddings/comments/1ojhaq7/advice_needed/,/r/weddings/comments/1ojhaq7/advice_needed/,2025-10-29 21:32:39,True,"My brother is getting married and is having a no kids wedding, but I have 2 kids (a toddler and newborn) and my husband and I are in the wedding.. I have no one to watch my kids since all our family is going, my in laws are invited (my husband’s family lives states away) and any friends I would ask are going to the wedding. My kids are not in the wedding and we were told they want them in pictures but not at the wedding. I’m honestly not sure what to do. I really don’t want to hire a random person since one of my kids is a newborn. Do I say we can’t go? 

Edit: newborn is 2 weeks old",<praw.models.reddit.submission.SubmissionFlair object at 0x000001BA36EE1070>,self.weddings,
1ok7wvj,Ideas for Custom Vows,1,1.0,4,TuxedoCats12-13-1989,weddings,https://www.reddit.com/r/weddings/comments/1ok7wvj/ideas_for_custom_vows/,/r/weddings/comments/1ok7wvj/ideas_for_custom_vows/,2025-10-30 18:39:19,True,"I was married in May. My husband and I wrote our own vows and I want to make something special that we can hang in our home commemorating those vows with a wedding picture. I am not very artistic. Ideally, I see a lot of pieces that have a set of vows on each side and a photo in the middle. I love this idea.. however, there is a major problem- my vows are at least two paragraphs longer than my husband's.. I know this is super annoying but I am a pretty chatty person and also am an aspiring poet/novelist. I write a lot in my free time and thought I had some great prose in my vows and did not want to cut any of it out. I love this man and I just wanted to shower him in love and praise on our wedding day.

 I tend to speak/read a lot faster than he does, so at the ceremony my vows did not feel like they were dragging on as much as they were. Still- I have no idea how to create a nice piece of artwork that includes both of our vows without highlighting how much longer mine are.. Again, I do not want to edit anything out because I want to show exactly what was said on our wedding day. Does anyone have any ideas on how to do this without it looking silly? 

  
There is no rush- I plan on giving it to him on our first wedding anniversary in late May 2026.

  
Thanks!",<praw.models.reddit.submission.SubmissionFlair object at 0x000001BA36EE1010>,self.weddings,
1ojor88,Bridal Party,13,0.89,14,Most_Star3224,weddings,https://www.reddit.com/r/weddings/comments/1ojor88/bridal_party/,/r/weddings/comments/1ojor88/bridal_party/,2025-10-30 03:00:58,True,"I recently got engaged. I’ve asked my sister to be my MOH. I’m asking another friend to be a bridesmaid. I always thought another friend would be a no brainer. I was in her wedding and we used to be very close friends. We’ve fallen apart and she only talks to me when she wants info and texted me both when I got engaged and when I asked my sister to be my MOH. My other bridesmaid heard her saying “I hope she doesn’t ask me to be her MOH” ….not that I would have. I feel like if I don’t ask her to be in my wedding it will cause a bigger issue. But, I really don’t want her in my wedding party. She hasn’t been a supportive friend in the last few years. It will be a small wedding party anyways. What would you do?",<praw.models.reddit.submission.SubmissionFlair object at 0x000001BA36EE0E90>,self.weddings,
1ojs4w7,Regret wedding vendors,5,0.86,3,No_Acanthisitta_6157,weddings,https://www.reddit.com/r/weddings/comments/1ojs4w7/regret_wedding_vendors/,/r/weddings/comments/1ojs4w7/regret_wedding_vendors/,2025-10-30 06:11:59,True,"I just had my wedding on 10/25 and everything was so magical but the vendors screwed up my entire day and I can’t get over how mad it makes me! Am i overreacting? 

The hair and makeup person arrived at 6AM even though we agreed on a start at 7:30AM. She had called the coordinator over dozens of times and rang the doorbell of the house we were hosting the event at that had most of our guests sleeping in it. She rushed to get everything done because she booked another wedding and lied to me about it. It truly pisses me off to my core. I had straight up asked her, why are you wanting to start early, and she said it was because she wanted to take her time but failed to mention booking another event which is really why she wanted to rush everything.

The coordinator was great but brought her entire family to help for the reception set up and didn’t mention that I’d have to feed her and her entire family. We ran out of food. I only booked a DJ, server, bartender, and the coordinator, and I swear there were like 10 random people walking around during the reception. 

We also had vendors eating and hoarding food before our guests! We ran out of food and ordered more than $1800 worth of BBQ catering for 45 guests. The coordinator should have been managing this and making sure vendors eat after guests but didn’t. 

I can’t get over how disappointed I am. I wish I never booked anyone and just handled shit on my own. ",<praw.models.reddit.submission.SubmissionFlair object at 0x000001BA36EE0D40>,self.weddings,
1ojxv7u,Need help with a custom suit for a very slim groom,1,1.0,3,Accomplished-Cow2011,weddings,https://www.reddit.com/r/weddings/comments/1ojxv7u/need_help_with_a_custom_suit_for_a_very_slim_groom/,/r/weddings/comments/1ojxv7u/need_help_with_a_custom_suit_for_a_very_slim_groom/,2025-10-30 12:06:41,True,"Hi! I’m new to Reddit and hoping to get some help. My husband-to-be and I are getting married in July 2026. My wedding dress is already ordered (custom at Azazie), but his suit is stressing me out, he’s very slim and most off-the-rack suits look loose, even after basic tailoring. I noticed Azazie also offers custom suits, but I haven’t seen many reviews.  
If you’ve tried Azazie suits, how was the fit, fabric, and turnaround time? And if you have other made-to-measure/bespoke recommendations that work well for a very slim frame, I’d really appreciate brand/shop names, price range, and how long it took. Thank you!",<praw.models.reddit.submission.SubmissionFlair object at 0x000001BA36EE0F80>,self.weddings,
1oij9mq,Black Tie,146,0.91,69,Suitable_Charge_9801,weddings,https://www.reddit.com/r/weddings/comments/1oij9mq/black_tie/,/r/weddings/comments/1oij9mq/black_tie/,2025-10-28 19:42:38,True,Don’t require black tie for men when you are going to serve a buffet with fried chicken. Just saying as someone who recently went to a wedding that thought just because it was at a country club every male should wear a tux. I think it is wrong if you are not having a true formal wedding. ,<praw.models.reddit.submission.SubmissionFlair object at 0x000001BA36EE0F50>,self.weddings,
1ojfabx,Father/daughter dance suggestions,1,0.67,52,UnitExtreme4518,weddings,https://www.reddit.com/r/weddings/comments/1ojfabx/fatherdaughter_dance_suggestions/,/r/weddings/comments/1ojfabx/fatherdaughter_dance_suggestions/,2025-10-29 20:14:20,True,"Hi all!

I am looking for a song suggestions for a father daughter dance. I would prefer something by old country icons (dolly, cash, reba, willie, lorretta, etc.) but have not been able to find something that is not overused, or incredibly cheesy. I would also go for folksy vibes, old or modern (john prine, watchhouse, something similar). Would love any and all suggestions! Thanks!",<praw.models.reddit.submission.SubmissionFlair object at 0x000001BA36EE0DA0>,self.weddings,
